FULLNAME;CODE;BBG_TICKER;NAME;INDUSTRY_SECTOR;INDUSTRY_SECTOR_NUM;GICS_SECTOR_NAME;GICS_SECTOR;CUR_MKT_CAP;EQY_FLOAT;EQY_FREE_FLOAT_PCT;FUND_ASSET_CLASS_FOCUS;SECTOR
MAGNESITA SA ON;MAGG3;MAGG3 BS Equity;MAGNESITA REFRATARIOS SA;Industrial;10011;Materials;15;815.817.986;166,6;58,81;#N/A N/A;Mineração. Produção e Comercialização de Extensa Linha de Materiais Refratários.
CEMEPE ON;MAPT3;MAPT3 BS Equity;CEMEPE INVESTIMENTOS S.A.;Financial;10008;Financials;40;5.138.820;0,12;2,74;#N/A N/A;Holding
CEMEPE PN;MAPT4;MAPT4 BS Equity;CEMEPE INVESTIMENTOS S.A.-PR;Financial;10008;Financials;40;5.138.820;0,23;5,01;#N/A N/A;Holding
IT NOW IMAT CI;MATB11;MATB11 BS Equity;IT NOW IMAT FUNDO DE INDICE;Funds;10009;#N/A N/A;#N/A N/A;12.519.000;#N/A N/A;#N/A N/A;Equity;#N/A N/A
FII MERC BR CI;MBRF11;MBRF11 BS Equity;MERCANTIL DO BRASIL FII;Financial;10008;#N/A N/A;#N/A N/A;112.796.211;#N/A N/A;#N/A N/A;Real Estate;#N/A N/A
MCDONALDS DRN;MCDC34;MCDC34 BS Equity;MCDONALD'S - BDR;Consumer, Cyclical;10004;Consumer Discretionary;25;238.999.288.874;#N/A N/A;#N/A N/A;#N/A N/A;#N/A N/A
M.DIASBRANCO ON;MDIA3;MDIA3 BS Equity;M DIAS BRANCO SA;Consumer, Non-cyclical;10005;Consumer Staples;30;11.084.065.000;41,9;36,93;#N/A N/A;Produção e Comercialização de Biscoitos. Massas. Farinha de Trigo e Farelo. Margarinas e Gorduras. Bolos e Snacks.
MENDES JR ON;MEND3;MEND3 BS Equity;MENDES JUNIOR ENGENHARIA SA;Industrial;10011;Industrials;20;92.784.492;0,05;0,7;#N/A N/A;Construção Pesada
MENDES JR PNA;MEND5;MEND5 BS Equity;MENDES JUNIOR ENGENHARIA-PRA;Industrial;10011;Industrials;20;92.784.492;0,15;9,91;#N/A N/A;Construção Pesada
MENDES JR PNB;MEND6;MEND6 BS Equity;MENDES JUNIOR ENGENHARIA-PRB;Industrial;10011;Industrials;20;92.784.492;1,8;100;#N/A N/A;Construção Pesada
MERC FINANC ON;MERC3;MERC3 BS Equity;MERCANTIL BRASIL FINANCEIRA;Financial;10008;Financials;40;81.225.100;0,55;5,36;#N/A N/A;Crédito. Financiamento e Investimentos.
MERC FINANC PN;MERC4;MERC4 BS Equity;MERCANTIL BRASIL FINANC-PREF;Financial;10008;Financials;40;81.225.100;2,32;29,62;#N/A N/A;Crédito. Financiamento e Investimentos.
FII MERITO I CI;MFII11;MFII11 BS Equity;FII MERITO I;Financial;10008;#N/A N/A;#N/A N/A;15.283.500;#N/A N/A;#N/A N/A;Real Estate;#N/A N/A
MANGELS INDL ON;MGEL3;MGEL3 BS Equity;MANGELS INDUSTRIAL SA;Basic Materials;10002;Materials;15;11.797.754;0;0,08;#N/A N/A;Produção de Relaminados. Trefilados e Perfilados de Aço. Exceto Arames.
MANGELS INDL PN;MGEL4;MGEL4 BS Equity;MANGELS INDUSTRIAL SA-PREF;Basic Materials;10002;Materials;15;11.797.754;8,53;76,48;#N/A N/A;Produção de Relaminados. Trefilados e Perfilados de Aço. Exceto Arames.
MAGAZ LUIZA ON;MGLU3;MGLU3 BS Equity;MAGAZINE LUIZA SA;Consumer, Cyclical;10004;Consumer Discretionary;25;1.451.955.736;54,14;29,83;#N/A N/A;Somos Uma Rede Varejista e Atuamos com Foco na Comercialização de Bens Duráveis no Brasil.
ISHARES MILA CI;MILA11;MILA11 BS Equity;ISHARES BM&FBOVESPA MIDLARGE;Funds;10009;#N/A N/A;#N/A N/A;4.968.000;#N/A N/A;#N/A N/A;Equity;#N/A N/A
MILLS ON;MILS3;MILS3 BS Equity;MILLS ESTRUTURAS E SERVICOS;Consumer, Non-cyclical;10005;Industrials;20;1.344.608.213;82,86;64,71;#N/A N/A;Serviços Especiais de Engenharia
JEREISSATI ON;MLFT3;MLFT3 BS Equity;JEREISSATI PARTICIPACOES SA;Financial;10008;Telecommunication Services;50;1.253.120.376;2,78;0,72;#N/A N/A;#N/A N/A
JEREISSATI PN;MLFT4;MLFT4 BS Equity;JEREISSATI PARTICIPACOES-PR;Financial;10008;Telecommunication Services;50;1.253.120.376;142,68;24,68;#N/A N/A;#N/A N/A
3M DRN;MMMC34;MMMC34 BS Equity;3M - BDR;Industrial;10011;Industrials;20;279.397.015.112;#N/A N/A;#N/A N/A;#N/A N/A;#N/A N/A
MMX MINER ON;MMXM3;MMXM3 BS Equity;MMX MINERACAO E METALICOS SA;Basic Materials;10002;Materials;15;116.787.293;42,35;26,11;#N/A N/A;Mineração de Minério de Ferro
MUNDIAL ON;MNDL3;MNDL3 BS Equity;MUNDIAL SA PROD DE CONSUMO;Industrial;10011;Consumer Discretionary;25;19.842.080;0,62;24,91;#N/A N/A;Componentes Diversos para Indústria de Calçados Confecções. Artigos de Cuidados Pessoais e de Cultelaria.
MINUPAR ON;MNPR3;MNPR3 BS Equity;MINUPAR PARTICIPACOES SA;Consumer, Non-cyclical;10005;Consumer Staples;30;49.700.700;294,3;41,45;#N/A N/A;"Criação. Abate Industrialização e Comercialização de Carnes e Produtos Derivados de Aves e Suinos; Importação e Exportação; Prestação de Serviços A Terceiros e Partipação em Outras Empresas"
MONT ARANHA ON;MOAR3;MOAR3 BS Equity;MONTEIRO ARANHA S.A.;Diversified;10006;Financials;40;1.716.151.038;2,99;24,41;#N/A N/A;Holding - Participação Societária
ISHARES MOBI CI;MOBI11;MOBI11 BS Equity;ISHARES BM&F BOVESPA IMOBIL;Funds;10009;#N/A N/A;#N/A N/A;2.430.000;#N/A N/A;#N/A N/A;Equity;#N/A N/A
MULTIPLUS ON;MPLU3;MPLU3 BS Equity;MULTIPLUS SA;Communications;10003;Consumer Discretionary;25;5.629.956.083;44,11;27,19;#N/A N/A;A Multiplus Atua com o Conceito de Rede de Empresas e Programas de Fidelização. por Meio Desta Rede. os Consumidores Podem Acumular e Resgatar Pontos Nos Estabelecimentos Parceiros.
MERCK DRN;MRCK34;MRCK34 BS Equity;MERCK & CO. INC.-BDR;Consumer, Non-cyclical;10005;Health Care;35;438.093.386.160;#N/A N/A;#N/A N/A;#N/A N/A;#N/A N/A
MARFRIG ON;MRFG3;MRFG3 BS Equity;MARFRIG GLOBAL FOODS SA;Consumer, Non-cyclical;10005;Consumer Staples;30;3.405.688.029;245,12;47,07;#N/A N/A;Produção e Distribuição de Alimentos À Base de Carne Bovina. Suína. Ovina e Avícola. In Natura. Elaborados e Processados. Couros Semi-Terminados e Terminados. Além de Outros Produtos Alimentícios.
MRV ON;MRVE3;MRVE3 BS Equity;MRV ENGENHARIA;Consumer, Cyclical;10004;Consumer Discretionary;25;3.840.144.298;287,45;64;#N/A N/A;Atividades de Incorporação e Construçãoatividades de Logística
MORGAN STAN DRN;MSBR34;MSBR34 BS Equity;MORGAN STANLEY-BDR;Financial;10008;Financials;40;163.272.548.494;#N/A N/A;#N/A N/A;#N/A N/A;#N/A N/A
MASTERCARD DRN;MSCD34;MSCD34 BS Equity;MASTERCARD INC - BDR;Consumer, Non-cyclical;10005;Information Technology;45;250.921.843.750;#N/A N/A;#N/A N/A;#N/A N/A;#N/A N/A
MICROSOFT DRN;MSFT34;MSFT34 BS Equity;MICROSOFT - BDR;Technology;10013;Information Technology;45;1.022.196.179.076;#N/A N/A;#N/A N/A;#N/A N/A;#N/A N/A
FII LARGO 13 CI;MSHP11;MSHP11 BS Equity;MAIS SHOPPING LARGO 13 FII;Financial;10008;#N/A N/A;#N/A N/A;62.679.600;#N/A N/A;#N/A N/A;Real Estate;#N/A N/A
MELHOR SP ON;MSPA3;MSPA3 BS Equity;CIA MELHORAMENTOS DE SAO PAU;Basic Materials;10002;Consumer Discretionary;25;#N/A N/A;0,33;5,91;#N/A N/A;#N/A N/A
MELHOR SP PN;MSPA4;MSPA4 BS Equity;CIA MELHORAMENTOS DE SAO-PRF;Basic Materials;10002;Consumer Discretionary;25;#N/A N/A;0,43;55,04;#N/A N/A;#N/A N/A
METAL IGUACU ON;MTIG3;MTIG3 BS Equity;METALGRAFICA IGUACU SA;Industrial;10011;Materials;15;37.501.920;12,19;11,7;#N/A N/A;Fábrica de Embalagens Metálicas para Alimentos
METAL IGUACU PN;MTIG4;MTIG4 BS Equity;METALGRAFICA IGUACU SA-PREF;Industrial;10011;Materials;15;37.501.920;71,07;34,11;#N/A N/A;Fábrica de Embalagens Metálicas para Alimentos
METISA PN;MTSA4;MTSA4 BS Equity;METISA METALURGICA TIMB-PREF;Basic Materials;10002;Industrials;20;141.585.004;3,44;61,92;#N/A N/A;Fabricação de Máquinas e Equipamentos para A Agricultura e Pecuária. Peças e Acessórios. Exceto para Irrigação.
MULTIPLAN ON;MULT3;MULT3 BS Equity;MULTIPLAN EMPREENDIMENTOS;Industrial;10011;Financials;40;9.805.756.215;76,23;42,79;#N/A N/A;Administração de Shopping Centers
WETZEL S/A ON;MWET3;MWET3 BS Equity;WETZEL SA;Basic Materials;10002;Industrials;20;#N/A N/A;0,26;3,8;#N/A N/A;Fabricação de Peças e Acessórios para Sistema Motor de Veículos Automotores
WETZEL S/A PN;MWET4;MWET4 BS Equity;WETZEL SA-PREF;Basic Materials;10002;Industrials;20;14.406.025;8,19;59,73;#N/A N/A;Fabricação de Peças e Acessórios para Sistema Motor de Veículos Automotores
FII MAXIMARC CI;MXRC11;MXRC11 BS Equity;MAXIMA RENDA CORPORATIVA FII;Financial;10008;#N/A N/A;#N/A N/A;41.777.851;#N/A N/A;#N/A N/A;Real Estate;#N/A N/A
FII MAXI REN CI;MXRF11;MXRF11 BS Equity;MAXI RENDA FII;Financial;10008;#N/A N/A;#N/A N/A;180.641.830;#N/A N/A;#N/A N/A;Real Estate;#N/A N/A
IOCHP-MAXION ON;MYPK3;MYPK3 BS Equity;IOCHPE-MAXION S.A.;Consumer, Cyclical;10004;Industrials;20;1.337.573.545;59,31;62,52;#N/A N/A;Fabricação e Comercialização de Produtos do Setor Automotivo e Equipamentos Ferroviários.
NADIR FIGUEI PN;NAFG4;NAFG4 BS Equity;NADIR FIGUEIREDO SA-PREF;Consumer, Cyclical;10004;Consumer Discretionary;25;217.264.496;3,1;38,46;#N/A N/A;Fabricação de Artigos de Vidro para Uso Doméstico e Embalagem
NATURA ON;NATU3;NATU3 BS Equity;NATURA COSMETICOS SA;Consumer, Non-cyclical;10005;Consumer Staples;30;15.209.808.841;171,42;39,75;#N/A N/A;Comércio Atacadista de Comércio e Produtos de Perfumaria
NET PN;NETC4;NETC4 BS Equity;NET SERVICOS DE COMUNI-PREF;Communications;10003;Consumer Discretionary;25;15.550.291.075;22,99;9,21;#N/A N/A;Multi-Operadora de Serviços Via Cabo de Tv por Assinatura . Vídeo Digital . Video em Alta Definição. Banda Larga e Voz.
NETFLIX DRN;NFLX34;NFLX34 BS Equity;NETFLIX INC-ADR;Communications;10003;Consumer Discretionary;25;65.163.060.766;#N/A N/A;#N/A N/A;#N/A N/A;#N/A N/A
NIKE DRN;NIKE34;NIKE34 BS Equity;NIKE INC - BDR;Consumer, Cyclical;10004;Consumer Discretionary;25;233.584.941.016;#N/A N/A;#N/A N/A;#N/A N/A;#N/A N/A
NORDON MET ON *;NORD3;NORD3 BS Equity;NORDON INDUS METALURGICA SA;Industrial;10011;Industrials;20;36.418.178;0,66;0,01;#N/A N/A;A Sociedade Tem como Atividade Operacional Preponderante A Produção de Bens de Capital Destinados ao Mercado Interno e Externo para os Setores Químico. Petrolífero. Petroquímico. Criogenia. Alimentíci
NUTRIPLANT ON;NUTR3;NUTR3 BS Equity;NUTRIPLANT INDUSTRIA E COMER;Basic Materials;10002;Materials;15;21.353.246;2,55;20,58;#N/A N/A;Industria e Comércio de Fertilizantes para Agricultura.
ODONTOPREV ON;ODPV3;ODPV3 BS Equity;ODONTOPREV S.A.;Financial;10008;Health Care;35;5.126.994.743;260,23;48,98;#N/A N/A;Operadora de Planos Odontológicos
OUROFINO S/A ON;OFSA3;OFSA3 BS Equity;OURO FINO SAUDE ANIMAL PARTI;Consumer, Non-cyclical;10005;Health Care;35;1.699.182.671;14,62;27,1;#N/A N/A;Participação em Outras Sociedades que Execerçam Atividades de Desenvolvimento. Fabricação e Comercialização de Produtos Destinados ao Setor de Saúde Animal.
OGX PETROLEO ON;OGXP3;OGXP3 BS Equity;OLEO E GAS PARTICIPACOES SA;Energy;10007;Energy;10;323.601.679;1.612,51;49,83;#N/A N/A;Participações em Outras Sociedades
OI ON;OIBR3;OIBR3 BS Equity;OI SA;Communications;10003;Telecommunication Services;50;12.218.915.675;1.113,70;38,92;#N/A N/A;#N/A N/A
OI PN;OIBR4;OIBR4 BS Equity;OI SA-PREFERENCE;Communications;10003;Telecommunication Services;50;12.218.915.675;3.585,56;62,65;#N/A N/A;#N/A N/A
FII THE ONE CI;ONEF11;ONEF11 BS Equity;FII THE ONE;Financial;10008;#N/A N/A;#N/A N/A;73.791.000;#N/A N/A;#N/A N/A;Real Estate;#N/A N/A
ORACLE DRN;ORCL34;ORCL34 BS Equity;ORACLE CORP - BDR;Technology;10013;Information Technology;45;468.030.638.340;#N/A N/A;#N/A N/A;#N/A N/A;#N/A N/A
OSX BRASIL ON;OSXB3;OSXB3 BS Equity;OSX BRASIL SA;Industrial;10011;Energy;10;140.653.606;106,21;33,98;#N/A N/A;Equipamentos e Serviços para A Indústria Offshore de Petróleo e Gás Natural
FII PANAMBY CI;PABY11;PABY11 BS Equity;FUNDO PANAMBY;Financial;10008;#N/A N/A;#N/A N/A;50.054.401;#N/A N/A;#N/A N/A;Real Estate;#N/A N/A
PANATLANTICA ON;PATI3;PATI3 BS Equity;PANATLANTICA SA;Basic Materials;10002;Materials;15;246.656.722;#N/A N/A;#N/A N/A;#N/A N/A;Industrialização e Comercialização de Aços Planos
PANATLANTICA PN;PATI4;PATI4 BS Equity;PANATLANTICA SA-PREF;Basic Materials;10002;Materials;15;246.656.722;0,25;39,82;#N/A N/A;Industrialização e Comercialização de Aços Planos
P.ACUCAR-CBD ON;PCAR3;PCAR3 BS Equity;CIA BRASILIERA DE DISTRIBUIC;Consumer, Non-cyclical;10005;Consumer Staples;30;28.778.785.102;0,06;0,06;#N/A N/A;Comércio Varejista
P.ACUCAR-CBD PN;PCAR4;PCAR4 BS Equity;CIA BRASILEIRA DE DIS-PREF;Consumer, Non-cyclical;10005;Consumer Staples;30;28.778.785.102;142,95;86,34;#N/A N/A;Comércio Varejista
PDG REALT ON;PDGR3;PDGR3 BS Equity;PDG REALTY SA;Financial;10008;Consumer Discretionary;25;1.468.823.288;1.323,26;100;#N/A N/A;Participação em Sociedades Atuantes no Setor Imobiliário
PAR AL BAHIA ON;PEAB3;PEAB3 BS Equity;CIA PARTICIP ALIANCA BAHIA;Diversified;10006;Industrials;20;385.508.340;2,6;40,47;#N/A N/A;Participações em Outras Sociedades. na Qualidade de Sócia E/ou Quotista e Administração de Bens Próprios
PAR AL BAHIA PN;PEAB4;PEAB4 BS Equity;CIA PARTICIP ALIANCA BA-PREF;Diversified;10006;Industrials;20;385.508.340;2,25;35,03;#N/A N/A;Participações em Outras Sociedades. na Qualidade de Sócia E/ou Quotista e Administração de Bens Próprios
PEPSICO INC DRN;PEPB34;PEPB34 BS Equity;PEPSICO INC - BDR;Consumer, Non-cyclical;10005;Consumer Staples;30;378.851.958.270;#N/A N/A;#N/A N/A;#N/A N/A;#N/A N/A
PETROBRAS ON;PETR3;PETR3 BS Equity;PETROBRAS - PETROLEO BRAS;Energy;10007;Energy;10;162.131.965.512;2.936,79;39,46;#N/A N/A;Petróleo. Gás e Energia
PETROBRAS PN;PETR4;PETR4 BS Equity;PETROBRAS - PETROLEO BRAS-PR;Energy;10007;Energy;10;162.131.965.512;3.746,09;66,87;#N/A N/A;Petróleo. Gás e Energia
PFIZER DRN;PFIZ34;PFIZ34 BS Equity;PFIZER INC - BDR;Consumer, Non-cyclical;10005;Health Care;35;560.526.737.936;#N/A N/A;#N/A N/A;#N/A N/A;#N/A N/A
PROFARMA ON;PFRM3;PFRM3 BS Equity;PROFARMA DISTRIBUIDORA;Consumer, Non-cyclical;10005;Health Care;35;402.638.299;12,65;30,48;#N/A N/A;Profarma Atua na Distribuição de Produtos Farmacêuticos. Higiene Pessoal e Cosméticos. Nos Mais Populosos Estados Brasileiros.
PG DRN;PGCO34;PGCO34 BS Equity;PROCTER & GAMBLE CO-BDR;Consumer, Non-cyclical;10005;Consumer Staples;30;602.157.278.800;#N/A N/A;#N/A N/A;#N/A N/A;#N/A N/A
IT NOW PIBB CI;PIBB11;PIBB11 BS Equity;IT NOW PIBB IBRX-50 FI;Funds;10009;#N/A N/A;#N/A N/A;1.249.815.674;#N/A N/A;#N/A N/A;Equity;#N/A N/A
PINE PN;PINE4;PINE4 BS Equity;BANCO PINE SA - PREF SHARES;Financial;10008;Financials;40;753.689.989;30,57;54,59;#N/A N/A;Banco de Atacado Focado no Relacionamento de Longo Prazo com Clientes de Grande Porte e Investidores. Oferece Crédito. Produtos de Hedging. Mercado de Capitais. Serviços de Assessoria Financeira.
PLASCAR PART ON;PLAS3;PLAS3 BS Equity;PLASCAR PARTICIPACOES SA;Consumer, Cyclical;10004;Consumer Discretionary;25;89.463.008;133,95;53,9;#N/A N/A;Participação em Outras Empresas
FII POLO I CI;PLRI11;PLRI11 BS Equity;POLO FII I;Financial;10008;#N/A N/A;#N/A N/A;105.288.361;#N/A N/A;#N/A N/A;Real Estate;#N/A N/A
PARANAPANEMA ON;PMAM3;PMAM3 BS Equity;PARANAPANEMA S.A.;Basic Materials;10002;Materials;15;839.435.357;178,68;55,98;#N/A N/A;Metalurgia do Cobre e Suas Ligas
DIMED ON;PNVL3;PNVL3 BS Equity;DIMED SA DISTRIBUIDORA DE ME;Consumer, Cyclical;10004;Health Care;35;934.834.525;1,61;39,17;#N/A N/A;Comercio Atacadista e Varejista de Medicamentos e Produtos de Perfumaria e Toucador
DIMED PN;PNVL4;PNVL4 BS Equity;DIMED SA DISTRIBUIDORA DE-PR;Consumer, Cyclical;10004;Health Care;35;934.834.525;0,41;91,64;#N/A N/A;Comercio Atacadista e Varejista de Medicamentos e Produtos de Perfumaria e Toucador
MARCOPOLO ON;POMO3;POMO3 BS Equity;MARCOPOLO SA;Consumer, Cyclical;10004;Industrials;20;3.726.831.378;53,05;15,53;#N/A N/A;#N/A N/A
MARCOPOLO PN;POMO4;POMO4 BS Equity;MARCOPOLO SA-PREF;Consumer, Cyclical;10004;Industrials;20;3.726.831.378;406,07;73,13;#N/A N/A;#N/A N/A
FII POLO CRI CI;PORD11;PORD11 BS Equity;FII POLO CRI;Financial;10008;#N/A N/A;#N/A N/A;104.900.002;#N/A N/A;#N/A N/A;Real Estate;#N/A N/A
POSITIVO INF ON;POSI3;POSI3 BS Equity;POSITIVO INFORMATICA SA;Technology;10013;Information Technology;45;240.572.000;24,06;27,4;#N/A N/A;Fabricação de Computadores.
FII D PEDRO CI;PQDP11;PQDP11 BS Equity;FI IMOBIL PAR DOM PED SHP CT;Financial;10008;#N/A N/A;#N/A N/A;307.635.315;#N/A N/A;#N/A N/A;Real Estate;#N/A N/A
PARANA PN;PRBC4;PRBC4 BS Equity;PARANA BANCO SA;Financial;10008;Financials;40;1.020.718.650;12,49;40,23;#N/A N/A;Banco Multiplo com Carteira de Crédito. Financiamento e Investimentos.
PRUMO ON;PRML3;PRML3 BS Equity;PRUMO LOGISTICA SA;Industrial;10011;Industrials;20;1.499.836.344;1.302,40;46,89;#N/A N/A;Atuação no Setor de Logísitica Portuária.
FII P VARGAS CI;PRSV11;PRSV11 BS Equity;FI IMOB PRESIDENTE VARGAS;Financial;10008;#N/A N/A;#N/A N/A;136.500.000;#N/A N/A;#N/A N/A;Real Estate;#N/A N/A
PROVIDENCIA ON;PRVI3;PRVI3 BS Equity;COMPANHIA PROVIDENCIA;Industrial;10011;Consumer Discretionary;25;682.750.856;23,01;28,75;#N/A N/A;Fabricação e Comercialização de Tecido Nãotecido. Resultante da Transformação de Polipropileno.
PORTO SEGURO ON;PSSA3;PSSA3 BS Equity;PORTO SEGURO SA;Financial;10008;Financials;40;10.057.646.163;94,34;29,18;#N/A N/A;Gestão de Participações Societárias (holding)
PORTOBELLO ON;PTBL3;PTBL3 BS Equity;PORTOBELLO SA;Industrial;10011;Industrials;20;752.820.456;69,42;43,8;#N/A N/A;Industrialização e Comercialização de Revestimentos Cerâmicos
PETTENATI ON;PTNT3;PTNT3 BS Equity;PETTENATI SA INDUSTRIA TEXTI;Consumer, Cyclical;10004;Consumer Discretionary;25;67.265.083;0,39;2,41;#N/A N/A;Fabricação de Tecidos Acabados em Malha Circular. Fabricação de Confecções do Vestuário
PETTENATI PN;PTNT4;PTNT4 BS Equity;PETTENATI SA INDUSTRIA-PREF;Consumer, Cyclical;10004;Consumer Discretionary;25;67.265.083;16,3;50,88;#N/A N/A;Fabricação de Tecidos Acabados em Malha Circular. Fabricação de Confecções do Vestuário
EVORA PN;PTPA4;PTPA4 BS Equity;EVORA SA-PREF;Diversified;10006;Materials;15;838.917.278;2,12;17,79;#N/A N/A;Empresa de Administração e Participação em Negócios de Embalagens Metálicas e Plásticas. Nãotecidos de Polipropileno e Florestamento.
QUALCOMM DRN;QCOM34;QCOM34 BS Equity;QUALCOMM INC-BDR;Technology;10013;Information Technology;45;309.142.547.671;#N/A N/A;#N/A N/A;#N/A N/A;#N/A N/A
QGEP PART ON;QGEP3;QGEP3 BS Equity;QGEP PARTICIPACOES SA;Energy;10007;Energy;10;2.126.455.240;90,4;34,01;#N/A N/A;Participação em Sociedades que Se Dediquem À Exploração. Produção Ecomercialização de Petróleo. Gás Natural e Seus Derivados. Seja como Sócio Ouacionista ou Outras Formas de Associações.
QUALICORP ON;QUAL3;QUAL3 BS Equity;QUALICORP SA;Consumer, Non-cyclical;10005;Health Care;35;7.600.174.946;255,41;93,42;#N/A N/A;Prestação de Serviços e Gestão de Benefícios de Assistência À Saúde.
RAIADROGASIL ON;RADL3;RADL3 BS Equity;RAIA DROGASIL SA;Consumer, Cyclical;10004;Consumer Staples;30;8.061.418.400;194,29;58,81;#N/A N/A;Comércio de Produtos Farmacêuticos. Perfumarias e Afins
CELUL IRANI ON;RANI3;RANI3 BS Equity;CELULOSE IRANI SA;Basic Materials;10002;Materials;15;535.171.954;15,39;10;#N/A N/A;Fabricação de Papel para Embalagem. Embalagens de Papelão Ondulado e Resinas.
CELUL IRANI PN;RANI4;RANI4 BS Equity;CELULOSE IRANI S.A.-PREF;Basic Materials;10002;Materials;15;535.171.954;1,88;14,64;#N/A N/A;Fabricação de Papel para Embalagem. Embalagens de Papelão Ondulado e Resinas.
RANDON PART ON;RAPT3;RAPT3 BS Equity;RANDON SA IMPLEMENTOS E PART;Consumer, Cyclical;10004;Industrials;20;1.674.414.062;11,62;11,35;#N/A N/A;"Indústria e Comércio de Veíc. Automotores e Rebocados para A Movimentação e o de Transporte de Materiais; de Implem para o Transp Rodoviário e Ferroviário e de Aparelhos Mecânicos. Peças"
RANDON PART PN;RAPT4;RAPT4 BS Equity;RANDON PARTICIPACOES SA-PREF;Consumer, Cyclical;10004;Industrials;20;1.674.414.062;145,79;72,04;#N/A N/A;"Indústria e Comércio de Veíc. Automotores e Rebocados para A Movimentação e o de Transporte de Materiais; de Implem para o Transp Rodoviário e Ferroviário e de Aparelhos Mecânicos. Peças"
FII JHSF FBV CI;RBBV11;RBBV11 BS Equity;FII JHSF FBV;Financial;10008;#N/A N/A;#N/A N/A;79.639.412;#N/A N/A;#N/A N/A;Real Estate;#N/A N/A
FII RIOBRCIB CI;RBCB11;RBCB11 BS Equity;RIO BRAVO CREDITO IMOB I FI;Financial;10008;#N/A N/A;#N/A N/A;37.701.530;#N/A N/A;#N/A N/A;Real Estate;#N/A N/A
FII RBRESID2 CI;RBDS11;RBDS11 BS Equity;RB CAPITAL DESENV RESID II;Financial;10008;#N/A N/A;#N/A N/A;145.121.887;#N/A N/A;#N/A N/A;Real Estate;#N/A N/A
FII RB GSB I CI;RBGS11;RBGS11 BS Equity;RB CAPITAL GENERAL SHOPPING;Financial;10008;#N/A N/A;#N/A N/A;66.264.664;#N/A N/A;#N/A N/A;Real Estate;#N/A N/A
FII RBPRIME2 CI;RBPD11;RBPD11 BS Equity;RB CAPITAL PRIME REALTY II-S;Financial;10008;#N/A N/A;#N/A N/A;28.400.000;#N/A N/A;#N/A N/A;Real Estate;#N/A N/A
FII RBPRIME1 CI;RBPR11;RBPR11 BS Equity;RB CAPITAL PRIME REALTY I;Financial;10008;#N/A N/A;#N/A N/A;16.000.000;#N/A N/A;#N/A N/A;Real Estate;#N/A N/A
FII RB II CI;RBRD11;RBRD11 BS Equity;RB CAPITAL RENDA II FUNDO;Financial;10008;#N/A N/A;#N/A N/A;120.384.613;#N/A N/A;#N/A N/A;Real Estate;#N/A N/A
FII RIOBCRI2 CI;RBVO11;RBVO11 BS Equity;RIO BRAVO CRED IMOB II FII;Financial;10008;#N/A N/A;#N/A N/A;44.747.730;#N/A N/A;#N/A N/A;Real Estate;#N/A N/A
FII REP 1 CI;RCCS11;RCCS11 BS Equity;REP 1 CCS-FI IMOBILIARIO;Financial;10008;#N/A N/A;#N/A N/A;#N/A N/A;#N/A N/A;#N/A N/A;Real Estate;#N/A N/A
RECRUSUL ON;RCSL3;RCSL3 BS Equity;RECRUSUL SA;Industrial;10011;Industrials;20;9.332.152;10,97;14,03;#N/A N/A;Produção e Comercialização de Equipamentos para Refrigeração Industrial e Unidades de Transportes.
RECRUSUL PN;RCSL4;RCSL4 BS Equity;RECRUSUL SA-PREF;Industrial;10011;Industrials;20;9.332.152;144,19;92,95;#N/A N/A;Produção e Comercialização de Equipamentos para Refrigeração Industrial e Unidades de Transportes.
FII RD ESCRI CI;RDES11;RDES11 BS Equity;RENDA DE ESCRITORIOS FII;Financial;10008;#N/A N/A;#N/A N/A;57.148.838;#N/A N/A;#N/A N/A;Real Estate;#N/A N/A
RODOBENSIMOB ON;RDNI3;RDNI3 BS Equity;RODOBENS NEG IMOB SA;Financial;10008;Consumer Discretionary;25;510.039.600;25,34;52,17;#N/A N/A;"(i) A Compra e Venda de Imóveis; (ii) o Desmembramento ou Loteamento de Terrenos; (iii) A Incorporação Imobiliária ou Construção de Imóveis Destinados À Venda; (iv) A Prestação de Serviços A Terceiros"
REDENTOR ON;RDTR3;RDTR3 BS Equity;REDENTOR ENERGIA SA;Utilities;10014;Utilities;55;564.100.306;3,46;3,19;#N/A N/A;Companhia Holding com Atuação no Setor Elétrico
REDE ENERGIA ON;REDE3;REDE3 BS Equity;REDE ENERGIA SA;Utilities;10014;Utilities;55;1.261.353.545;894,97;75,7;#N/A N/A;Participação em Outras Empresas (a Rede Energia É Uma Holding)
REDE ENERGIA PN;REDE4;REDE4 BS Equity;REDE EMPRESAS DE ENER-PREF;Utilities;10014;Utilities;55;1.261.353.545;396,06;74,37;#N/A N/A;Participação em Outras Empresas (a Rede Energia É Uma Holding)
LOCALIZA ON;RENT3;RENT3 BS Equity;LOCALIZA RENT A CAR;Consumer, Non-cyclical;10005;Industrials;20;7.412.769.000;149,44;70,56;#N/A N/A;Aluguel de Carros e Gestão de Frotas
RJCP EQUITY ON;RJCP3;RJCP3 BS Equity;RCJP EQUITY SA;Financial;10008;Financials;40;14.124.841;1.155,23;81,79;#N/A N/A;Administração de Participações Societárias.
COSAN LOG ON;RLOG3;RLOG3 BS Equity;COSAN LOGISTICA SA;Industrial;10011;Industrials;20;1.408.323.145;152,16;37,49;#N/A N/A;Administração. Direta ou Indireta. de Participações Societárias em Empresas do Setor de Infraestrutura.
RENAR ON;RNAR3;RNAR3 BS Equity;RENAR MACAS SA;Consumer, Non-cyclical;10005;Consumer Staples;30;29.008.125;2,93;38,63;#N/A N/A;Pomicultura Produção. Comercialização e Exportação
FII BB R PAP CI;RNDP11;RNDP11 BS Equity;BB RENDA DE PAPEIS IMOB FII;Financial;10008;#N/A N/A;#N/A N/A;97.807.709;#N/A N/A;#N/A N/A;Real Estate;#N/A N/A
RENOVA UNT;RNEW11;RNEW11 BS Equity;RENOVA ENERGIA SA-UNITS;Energy;10007;Utilities;55;4.035.239.865;106,22;100;#N/A N/A;Geração de Energia por Meio de Fontes Renováveis.
RENOVA ON;RNEW3;RNEW3 BS Equity;RENOVA ENERGIA SA;Energy;10007;Utilities;55;#N/A N/A;30,72;12,97;#N/A N/A;Geração de Energia por Meio de Fontes Renováveis.
RENOVA PN;RNEW4;RNEW4 BS Equity;RENOVA ENERGIA SA;Energy;10007;Utilities;55;#N/A N/A;39,15;47,86;#N/A N/A;Geração de Energia por Meio de Fontes Renováveis.
FII RIONEGRO CI;RNGO11;RNGO11 BS Equity;FII RIO NEGRO;Financial;10008;#N/A N/A;#N/A N/A;215.953.186;#N/A N/A;#N/A N/A;Real Estate;#N/A N/A
INDS ROMI ON;ROMI3;ROMI3 BS Equity;INDUSTRIAS ROMI SA;Industrial;10011;Industrials;20;231.777.200;23,34;32,53;#N/A N/A;Indústria e Comércio de Máquinas-Ferramenta
ALFA HOLDING ON;RPAD3;RPAD3 BS Equity;ALFA HOLDINGS SA;Financial;10008;Financials;40;273.098.421;2,82;6,12;#N/A N/A;Participar como Sócio ou Acionista de Sociedades. na Qualidade de Cotista. Acionista. ou de Outra Forma Legalmente Adminssivel
ALFA HOLDING PNA;RPAD5;RPAD5 BS Equity;ALFA HOLDINGS SA-PREF A;Financial;10008;Financials;40;273.098.421;3,37;23,51;#N/A N/A;Participar como Sócio ou Acionista de Sociedades. na Qualidade de Cotista. Acionista. ou de Outra Forma Legalmente Adminssivel
ALFA HOLDING PNB;RPAD6;RPAD6 BS Equity;ALFA HOLDINGS SA-PREF B;Financial;10008;Financials;40;273.098.421;12,6;51,73;#N/A N/A;Participar como Sócio ou Acionista de Sociedades. na Qualidade de Cotista. Acionista. ou de Outra Forma Legalmente Adminssivel
PET MANGUINH ON;RPMG3;RPMG3 BS Equity;REFINARIA DE PETROLEOS MANGU;Energy;10007;Energy;10;342.638.953;403,01;38,04;#N/A N/A;Fabricação de Produtos de Refino de Petróleo.
PET MANGUINH PN;RPMG4;RPMG4 BS Equity;REFINARIA DE PETROLEOS-PREF;Energy;10007;Energy;10;342.638.953;81,54;98,62;#N/A N/A;Fabricação de Produtos de Refino de Petróleo.
ROSSI RESID ON;RSID3;RSID3 BS Equity;ROSSI RESIDENCIAL SA;Consumer, Cyclical;10004;Consumer Discretionary;25;329.344.067;77,97;90,9;#N/A N/A;O Objeto Social É A Compra e Venda de Imóveis. Desmembramento e Loteamento de Terrenos. Incorporação Imobiliária e Construção de Imóveis Destinados À Venda.
RIOSULENSE PN;RSUL4;RSUL4 BS Equity;METALURGICA RIOSULENSE SA-PR;Basic Materials;10002;Industrials;20;11.660.000;0,05;19,39;#N/A N/A;Industria Mecâno Metalúrgica
FII SANT AGE CI;SAAG11;SAAG11 BS Equity;SANTANDER AGENCIAS FII;Financial;10008;#N/A N/A;#N/A N/A;484.310.028;#N/A N/A;#N/A N/A;Real Estate;#N/A N/A
